name,url,review_score,review_heading,profile_contr,review_body,date_of_stay,company
stroller,https://www.tripadvisor.ca/ShowUserReviews-g297685-d319858-r825934245-Ganges_River-Varanasi_Varanasi_District_Uttar_Pradesh.html,N/A,Varanasi,19 contributions,"The sacred river carry much value to Hindu. Just touching the water bring much joy to lord Shiva and Ma Ganges. For non Hindu, spending time on a boat looking around in the morning is quite pleasant",Feb 2021 , Friends
Dinesh,https://www.tripadvisor.ca/ShowUserReviews-g297685-d319858-r824519581-Ganges_River-Varanasi_Varanasi_District_Uttar_Pradesh.html,N/A,It is the Ganga!,58 contributions,"A boat ride in the river in the morning and also in the evening is magical. The water is now clean, the river is mighty. The view of the ghats from the river, enchanting.",Dec 2021, 
Sushil Kumar Khanna,https://www.tripadvisor.ca/ShowUserReviews-g297685-d319858-r821880068-Ganges_River-Varanasi_Varanasi_District_Uttar_Pradesh.html,N/A,Very satisfying and enjoyable trip,4 contributions,Have a boat ride covering all the ghats of Ganga river and must see the Ganga Arti in the evening. Preferably stay at one of the haveli's on the bank of Ganga to really enjoy the sunrise and oter activities happenings.,Dec 2021 , Couples
VaidyaVikrant,https://www.tripadvisor.ca/ShowUserReviews-g297685-d319858-r821068611-Ganges_River-Varanasi_Varanasi_District_Uttar_Pradesh.html,N/A,Ganga is ganga Its has Vibrations of Universe,298 contributions,Ganga River is one of the Most Religious river which has its own soul to Bless you all the time.It may reveals Water river but Ganga is uNique in its Place giving Vibrations Of Purity embracing mind and soul,Nov 2021, 
Ananth 727499,https://www.tripadvisor.ca/ShowUserReviews-g297685-d319858-r820206246-Ganges_River-Varanasi_Varanasi_District_Uttar_Pradesh.html,N/A,Silence could only be the words to explain the experience,"1,336 contributions","This is really a gift to be here with family and intake the real beauty and observe the greatness of Ganges.During the morning time (around 8-10), of you happen to get a chance, do go for a boat ride..You could see numberous birds flying here and there and circling out boats..Neatly maintained and really much effort is taken by the government to keep the ghats clean and good.For boat ride ( motor boat) the cost will be around 1500-2000 for about 1 hour..It varies depending upon the season and rush..During Dev Diwali timings, the cost would go to peak (around 7000-10000)..Divine experience and in explainable feeeling..No words to express..If you happen to visit here and see the great Ganges, then do understand just one thing ""YOUR LIFE IS BLESSED""",Nov 2021 , Family
Nari j,https://www.tripadvisor.ca/ShowUserReviews-g297685-d319858-r817733748-Ganges_River-Varanasi_Varanasi_District_Uttar_Pradesh.html,N/A,Eye catching,2 contributions,you can feel a vibration in you on ganga when you worship and whole heartdly Ganga Arthi was mind blowing,Oct 2021 , Family
Raghuram,https://www.tripadvisor.ca/ShowUserReviews-g297685-d319858-r817254067-Ganges_River-Varanasi_Varanasi_District_Uttar_Pradesh.html,N/A,Mind opening experience.,4 contributions,"Did both the evening and sunrise boat rides, each very different. Hard to put in words - only to be experienced and each one will feel different.",Oct 2021, 
Gautam C,https://www.tripadvisor.ca/ShowUserReviews-g297685-d319858-r816968858-Ganges_River-Varanasi_Varanasi_District_Uttar_Pradesh.html,N/A,Ganga Aarati,9 contributions,"The Ganga Aarti  done in the evening in Dasashamedha ghat , Assi ghat etc are excellant . we can take a boat ride in ganges , and we can enjoy the ganga aarti  during evening",Oct 2021, 
arjunajb,https://www.tripadvisor.ca/ShowUserReviews-g297685-d319858-r815755951-Ganges_River-Varanasi_Varanasi_District_Uttar_Pradesh.html,N/A,Visit the Ganga at Varanasi,376 contributions,"Very thrilled to see the clean and unpolluted Ganga, tidy ghats, beautifully lit, early morning dip, evening cruise or boat ride and life is fulfilled",Oct 2021 , Friends
SHAILESH M,https://www.tripadvisor.ca/ShowUserReviews-g297685-d319858-r814679907-Ganges_River-Varanasi_Varanasi_District_Uttar_Pradesh.html,N/A,Serene & peaceful,52 contributions,"To get a great experience take a morning boat ride & watch the sunrise on the fast flowing river. It’s also a solemn experience to watch the evening Arti performed on the river bank . To avoid the crowds assembled on the banks , it is best to experience it from the upper deck of the Alaknanda cruise  ship .This is an air conditioned  vessel with a seating capacity of 60. Booking is to be done online in advance @ 900/- per person for the evening cruise. Very clean boat with clean bio toilets . They also serve complementary coffee & biscuits.",Oct 2021 , Couples
debparamita,https://www.tripadvisor.ca/ShowUserReviews-g297685-d319858-r810122375-Ganges_River-Varanasi_Varanasi_District_Uttar_Pradesh.html,N/A,The Great Holy Ganga,26 contributions,"Take a row boat and move up the river. Best at twilight. The Ghats look great from the river. The ""aarati"" at Dasheshwamedh Ghat is something not to be missed. More information on Papumashi the Nomad -----The Great Gangetic Plain and The Kumbh Mela.",Jan 2021, 
DrKanishkMarkam,https://www.tripadvisor.ca/ShowUserReviews-g297685-d319858-r785512924-Ganges_River-Varanasi_Varanasi_District_Uttar_Pradesh.html,N/A,"It's not about the view, it's about the feeling",23 contributions,Visit any of the 40 ghats of varanasi to experience the banks of holy Ganges. Boat rides are ample & opportunity to take a dip should not be missed. Try visiting in March April to take the benefit of better weather conditions. ,Mar 2021 , Friends
Dr.M.Rameshwaran,https://www.tripadvisor.ca/ShowUserReviews-g297685-d319858-r784003338-Ganges_River-Varanasi_Varanasi_District_Uttar_Pradesh.html,N/A,I feel good energy lord shiva ,153 contributions,"Kashi Vishwanath MandirSituated on the western banks of the River Ganga, Kashi Vishwanath Mandir is one of the 12 holiest jyotirlingas or sacred centers of Shiva worship across India. This significant Varanasi Shiva temple even finds mention in the holy Puranas.I feel good energy lord shiva City not clean You can stay 5*****hotel good for your health Please take the guide Following himDon’t give me too much money See you again ",Mar 2021 , Family
Abhishek B,https://www.tripadvisor.ca/ShowUserReviews-g297685-d319858-r783290705-Ganges_River-Varanasi_Varanasi_District_Uttar_Pradesh.html,N/A,Mesmerising Ganga,63 contributions,"Ganga Maiyya! In Varanasi , the river a bit steady and slow moving. Both the evening Aarti and the sunrise are total must to experience the river. It’s truly divine. Just being there is meditative, takes you very deep in thoughts. The ghats, the people and their stories just adds more charm. Highly recommend boat ride during sunrise",Feb 2021 , Friends
Jayvijay Sachan,https://www.tripadvisor.ca/ShowUserReviews-g297685-d319858-r781748840-Ganges_River-Varanasi_Varanasi_District_Uttar_Pradesh.html,N/A,Assi Ghat ,10 contributions,"A lot can be said about the Assi Ghat, but those will only be words. Its a must visit place.Their is so much of solitude at the Assi Ghat. It offers a amazing view of the Ganga ji and one must visit this place not for the spiritual significance but for the quaint aspect of Banaras.",Jan 2021, 
cp_0010,https://www.tripadvisor.ca/ShowUserReviews-g297685-d319858-r780378013-Ganges_River-Varanasi_Varanasi_District_Uttar_Pradesh.html,N/A,Very sacred,"1,499 contributions","Ganga river is one of the most sacred rivers among Hindus in India. Ganga river originates from Gangotri in the north of India where it is named Bhagirathi after King Bhagirath who is known for bringing Ganga down on earth by worshipping and Ganga meets sea at Gangasagar near Kolkata in West Bengal. During this journey, it purifies millions of people who take bath in its holy water.Ganga flows through Varanasi as well and there are 84 ghats along side. People do take this wonderful opportunity to take bath in the holy water and purify them. An arti is peformed in the evening which is worth watching. We did a boat ride in the early morning to take a breathtaking view of Benaras ghats. The rates of boats are negotiable, for safety it is advisable to book through hotel and if you are in big group then you may take a boat directly.",Feb 2020, 
