name,url,review_score,review_heading,profile_contr,review_body,date_of_stay,company
Sandeep A,https://www.tripadvisor.ca/ShowUserReviews-g297685-d478221-r885642021-Sarnath-Varanasi_Varanasi_District_Uttar_Pradesh.html,3.0 of 5 bubbles,Not much exciting,14 contributions,"It is far away place (10 km) from Banaras. In chilling sun, it is difficult to visit this place. Not much to do here. Will like to skip it next time. For me, Ganga bathing and visiting temples is more than enough.",Apr-23, 
DipakJivnani,https://www.tripadvisor.ca/ShowUserReviews-g297685-d478221-r885258463-Sarnath-Varanasi_Varanasi_District_Uttar_Pradesh.html,4.0 of 5 bubbles,Afternoon visit of Sarnath for Light n Sound Show,94 contributions,We visited in late afternoon and went for light n sound show at Dhamek Stupa. We were late to visit the museum as it close at 5 PM. Laser show on stupa is good for family to get a short insight into Lord Buddha's early life.  The lawns and remains of meditation facilities are well maintained. Overall a must visit place when at Varanasi.,Mar-23, 
Abha K,https://www.tripadvisor.ca/ShowUserReviews-g297685-d478221-r884358800-Sarnath-Varanasi_Varanasi_District_Uttar_Pradesh.html,5.0 of 5 bubbles,Good site seeing and shopping at Lakshal,15 contributions,Went there in month of March. Great place to spend half a day. Visited the main temple and the Dhamek Stupa. Visited Lakshal store on the town square. Great shopping there.To get to Sarnath we went with out tour guide Pappuji mob.9839067293. He's a very good guide. Punctual and caring. Went out of his way to make our trip a great success. Would recommend if you travel with senior citizens and children.,Mar-23, 
Heather G,https://www.tripadvisor.ca/ShowUserReviews-g297685-d478221-r883987389-Sarnath-Varanasi_Varanasi_District_Uttar_Pradesh.html,5.0 of 5 bubbles,Great Varanasi guide,6 contributions,"Papu was a lovely host - very friendly and extremely knowledgeable. He was able to guide us through the streets of Varanasi by car, tuk tuk and on foot. We felt very safe and reassured that he was with us. He also shared his book of stories with us - would recommend to any traveler :-)",Mar-23, Friends
Olivia C,https://www.tripadvisor.ca/ShowUserReviews-g297685-d478221-r883987385-Sarnath-Varanasi_Varanasi_District_Uttar_Pradesh.html,5.0 of 5 bubbles,Pappu is a hero,10 contributions,We loved Pappu. He drives around like a total hero and has a black belt in navigating a tuk tuk. We felt very safe with him.He’s super knowledgeable about Varanassi too and took us everywhere we wanted to go. All round 5 star rating. :),Mar-23, Friends
Dennis P,https://www.tripadvisor.ca/ShowUserReviews-g297685-d478221-r883582232-Sarnath-Varanasi_Varanasi_District_Uttar_Pradesh.html,4.0 of 5 bubbles,Peaceful and very meaningful to the Hindu faith,"2,107 contributions","Sarnath (Hindustani pronunciation: [saːɾnaːtʰ], also referred to as Sarangnath, Isipatana, Rishipattana, Migadaya, or Mrigadava)[1] is a place located 10 kilometres (6.2 miles) northeast of Varanasi, near the confluence of the Ganges and the Varuna rivers in Uttar Pradesh, India.The entire area is a remarkable archealogical site.More important to the Hindu religion is that around 535 BCE Budda gave his first sermon",Feb-23, 
two201,https://www.tripadvisor.ca/ShowUserReviews-g297685-d478221-r883465363-Sarnath-Varanasi_Varanasi_District_Uttar_Pradesh.html,4.0 of 5 bubbles,Overall nice experience,20 contributions,"Visit to Buddha park was memorable, quite and clean place. Guide too was polite and was helpful, in explaining.Museum too is good but the ticketing system need improvement and toilets too need more cleaning,Stupas are worth visiting.",Mar-23, 
RC16,https://www.tripadvisor.ca/ShowUserReviews-g297685-d478221-r882750462-Sarnath-Varanasi_Varanasi_District_Uttar_Pradesh.html,3.0 of 5 bubbles,A “Can be a great” experience,8 contributions,"Leaves much to expectation… i mean they could or may be still can do a lot with this space but alas… so much chaos… under construction roads, crazy rickshaws, under prepared ticketings…. Whoof… it takes the whole soul out of the outstanding experience that it could have provided…Wake up guys..",Mar-23, Family
